verb_id,lex,scroll,book,chapter,verse_num,gcons_verb,gcons_verse,sign_info,stem,tense,gcons_clause,subject,complement,cmpl_lex,cmpl_translation,dir_he,cmpl_constr,cmpl_nt,cmpl_anim,cmpl_det,cmpl_indiv,cmpl_complex,motion_type,preposition_1,preposition_2,preposition_3,preposition_4,comments
212315,SWR[,MT,Isaiah,1,16,HSJRW,RXYW HZKW HSJRW R< M<LLJKM M NGD <JNJ XDLW HR<,,hif,impv,HSJRW R< M<LLJKM M NGD <JNJ,,M NGD <JNJ,MN NGD/ <JN/,from before my eyes,0,prep,bopa,inanim,det,subs,complex,fictive,MN,,,,
1895129,SWR[,1Qisaa,Isaiah,1,16,HSJRW,RXYW W HZKW W HSJRW RW< M<LLJKM M NGD <JNJ XDLW HR<,0000 0 0000 0 00000 000 00000000 0 000 00000 0000 000 00,hif,impv,W HSJRW RW< M<LLJKM M NGD <JNJ,,M NGD <JNJ,MN NGD/ <JN/,from before my eyes,0,prep,bopa,inanim,det,subs,complex,fictive,MN,,,,
212418,BW>[,MT,Isaiah,1,23,JBW>,FRJK SWRRJM W XBRJ GNBJM KLW >HB CXD W RDP CLMNJM JTWM L> JCPVW W RJB >LMNH L> JBW> >LJHM,,qal,impf,W RJB >LMNH L> JBW> >LJHM,RJB >LMNH,>LJHM,>L,to them,0,prep,prps,anim,det,prsf,simple,fictive,>L,,,,
1895234,BW>[,1Qisaa,Isaiah,1,23,JBW>,FRJKJ SWRRJM W XBRJ GNBJM KWLM >WHBJ CWXD RWDPJ CLMWNJM J>TWM LW> JCPVW W RJB >LMNH LW> JBW> >LJHM,000000 000000 0 0000 00000 00000 00000 0000 00000 0000000 00000 000 00000 0 000 00000 000 0000 000000 00,qal,impf,W RJB >LMNH LW> JBW> >LJHM,RJB >LMNH,>LJHM,>L,to them,0,prep,prps,anim,det,prsf,simple,fictive,>L,,,,
212437,CWB[,MT,Isaiah,1,25,>CJBH,W >CJBH JDJ <LJK W >YRP K BR SJGJK W >SJRH KL BDJLJK,,hif,impf,W >CJBH JDJ <LJK,,<LJK,<L,against you,0,prep,prps,anim,det,prsf,simple,factive fictive,<L,,,,
1895257,CWB[,1Qisaa,Isaiah,1,25,HCJB,W HCJB JDJ <LJK W >YRP K BR SWGJK W >SJR KWL BDJLJK,0 0000 0000 00000 0 0000 0 00 000000 0 0000 000 0000000 00,hif,perf,W HCJB JDJ <LJK,,<LJK,<L,against you,0,prep,prps,anim,det,prsf,simple,factive fictive,<L,,,,
212564,NHR[,MT,Isaiah,2,2,NHRW,W HJH B >XRJT H JMJM NKWN JHJH HR BJT JHWH B R>C H HRJM W NF> M GB<WT W NHRW >LJW KL H GWJM,,qal,perf,W NHRW >LJW KL H GWJM,KL H GWJM,>LJW,>L,to it (the mountain),0,prep,prps,inanim,det,prsf,simple,factive,>L,,,,
1895388,NHR[,1Qisaa,Isaiah,2,2,NHRW,W HJH B >XRJT H JMJM NKWN JHJH HR BJT JHWH B R>C HRJM W NF> M GB<WT W NHRW <LWHJ KWL H GW>JM,0 000 0 00000 0 0000 0000 0000 00 000 0000 0 000 0000 0 000 0 00000 0 0000 000000 000 0 00000 00,qal,perf,W NHRW <LWHJ KWL H GW>JM,KWL H GW>JM,<LWHJ,<L,to it (the mountain),0,prep,prps,inanim,det,prsf,simple,factive,<L,,,,
212577,<LH[,MT,Isaiah,2,3,N<LH,W HLKW <MJM RBJM W >MRW LKW W N<LH >L HR JHWH >L BJT >LHJ J<QB W JRNW M DRKJW W NLKH B >RXTJW KJ M YJWN TY> TWRH W DBR JHWH M JRWCLM,,qal,impf,W N<LH >L HR JHWH >L BJT >LHJ J<QB,,>L HR JHWH >L BJT >LHJ J<QB,>L HR/ JHWH/ >L BJT/ >LHJM/ J<QB/,to the mountain of Yahwe to the house of the God of Jacob,0,prep,topo,inanim,det,subs,complex,factive,>L,>L,,,
212590,HLK[,MT,Isaiah,2,3,NLKH,W HLKW <MJM RBJM W >MRW LKW W N<LH >L HR JHWH >L BJT >LHJ J<QB W JRNW M DRKJW W NLKH B >RXTJW KJ M YJWN TY> TWRH W DBR JHWH M JRWCLM,,qal,impf,W NLKH B >RXTJW,,B >RXTJW,B >RX/,in his paths,0,prep,abs,inanim,det,subs,complex,factive fictive,B,,,,
212596,JY>[,MT,Isaiah,2,3,TY>,W HLKW <MJM RBJM W >MRW LKW W N<LH >L HR JHWH >L BJT >LHJ J<QB W JRNW M DRKJW W NLKH B >RXTJW KJ M YJWN TY> TWRH W DBR JHWH M JRWCLM,,qal,impf,KJ M YJWN TY> TWRH,TWRH,M YJWN,MN YJWN==/,from Zion,0,prep,topo,inanim,det,nmpr,simple,fictive,MN,,,,subj TWRH immaterial-fictive
1895402,<LH[,1Qisaa,Isaiah,2,3,N<LH,W HLKW <MJM RBJM W >MRW LKW W N<LH >L BJT >LWHJ J<QWB W JRWNW M DRKJW W N>LKH B >WRXTJW KJ> M YJWN TY> TWRH W DBR JHWH M JRWCLJM,0 0000 0000 0000 0 0000 000 0 0000 00 000 00000 00000 0 000000 0 000000 0 00000 0 00000000 000 0 0000 000 0000 0 000 0000 0 0000000 00,qal,impf,W N<LH >L BJT >LWHJ J<QWB,,>L BJT >LWHJ J<QWB,>L BJT/ >LHJM/ J<QB/,to the house of the God of Jacob,0,prep,topo,inanim,det,subs,complex,factive,>L,,,,
1895412,HLK[,1Qisaa,Isaiah,2,3,N>LKH,W HLKW <MJM RBJM W >MRW LKW W N<LH >L BJT >LWHJ J<QWB W JRWNW M DRKJW W N>LKH B >WRXTJW KJ> M YJWN TY> TWRH W DBR JHWH M JRWCLJM,0 0000 0000 0000 0 0000 000 0 0000 00 000 00000 00000 0 000000 0 000000 0 00000 0 00000000 000 0 0000 000 0000 0 000 0000 0 0000000 00,qal,impf,W N>LKH B >WRXTJW,,B >WRXTJW,B >RX/,in his paths,0,prep,abs,inanim,det,subs,complex,factive fictive,B,,,,
1895418,JY>[,1Qisaa,Isaiah,2,3,TY>,W HLKW <MJM RBJM W >MRW LKW W N<LH >L BJT >LWHJ J<QWB W JRWNW M DRKJW W N>LKH B >WRXTJW KJ> M YJWN TY> TWRH W DBR JHWH M JRWCLJM,0 0000 0000 0000 0 0000 000 0 0000 00 000 00000 00000 0 000000 0 000000 0 00000 0 00000000 000 0 0000 000 0000 0 000 0000 0 0000000 00,qal,impf,KJ> M YJWN TY> TWRH,TWRH,M YJWN,MN YJWN==/,from Zion,0,prep,topo,inanim,det,nmpr,simple,fictive,MN,,,,subj TWRH immaterial-fictive
212637,HLK[,MT,Isaiah,2,5,NLKH,BJT J<QB LKW W NLKH B >WR JHWH,,qal,impf,W NLKH B >WR JHWH,,B >WR JHWH,B >WR/ JHWH/,in the light of Yahwe,0,prep,abs,inanim,det,subs,complex,fictive,B,,,,
1895466,HLK[,1Qisaa,Isaiah,2,5,NLKH,BJT J<QWB LKW W NLKH B >WR JHWH,000 00000 000 0 0000 0 000 0000 00,qal,impf,W NLKH B >WR JHWH,,B >WR JHWH,B >WR/ JHWH/,in the light of Yahwe,0,prep,abs,inanim,det,subs,complex,fictive,B,,,,
212702,BW>[,MT,Isaiah,2,10,BW>,BW> B YWR W HVMN B <PR M PNJ PXD JHWH W M HDR G>NW,,qal,impv,BW> B YWR,,B YWR,B H YWR/,in the rock,0,prep,topo,inanim,det,subs,simple,factive,B,,,,
212830,BW>[,MT,Isaiah,2,19,B>W,W B>W B M<RWT YRJM W B MXLWT <PR M PNJ PXD JHWH W M HDR G>WNW B QWMW L <RY H >RY,,qal,perf,W B>W B M<RWT YRJM W B MXLWT <PR M PNJ PXD JHWH W M HDR G>WNW,,B M<RWT YRJM W B MXLWT <PR,B M<RH/ YWR/ W B MXLH==/ <PR/,in caves of rocks and in holes of dust,0,prep,topo,inanim,und,subs,complex,factive,B,B,,,
1895648,BW>[,1Qisaa,Isaiah,2,19,B>W,W B>W B M<RWT YWRJM W B MXLWT <PR M PNJ PXD JHWH W M HDR G>WNW B QWMW L <RWY H >RY,0 000 0 00000 00000 0 0 00000 000 0 000 000 0000 0 0 000 000000 0 00000 0 0000 0 000 00,qal,perf,W B>W B M<RWT YWRJM W B MXLWT <PR M PNJ PXD JHWH W M HDR G>WNW,,B M<RWT YWRJM W B MXLWT <PR,B M<RH/ YWR/ W B MXLH==/ <PR/,in caves of rocks and in holes of dust,0,prep,topo,inanim,und,subs,complex,factive,B,B,,,
212880,BW>[,MT,Isaiah,2,21,BW>,L BW> B NQRWT H YRJM W B S<PJ H SL<JM M PNJ PXD JHWH W M HDR G>WNW B QWMW L <RY H >RY,,qal,infc,L BW> B NQRWT H YRJM W B S<PJ H SL<JM M PNJ PXD JHWH W M HDR G>WNW,,B NQRWT H YRJM W B S<PJ H SL<JM,B NQRH/ H YWR/ W B S<JP/ H SL</,in the caverns of the rocks and in the clefts of the cliffs,0,prep,topo,inanim,det,subs,complex,factive,B,B,,,
1895697,BW>[,1Qisaa,Isaiah,2,21,BW>,L BW> B NQRWT H YWRJM W B S<PJ H SL<JM M PNJ PXD JHWH W M HDR G>WNW B QWMW L <RWY H >RY,0 000 0 00000 0 00000 0 0 0000 0 00000 0 000 000 0000 0 0 000 000000 0 00000 0 0000 0 000 00,qal,infc,L BW> B NQRWT H YWRJM W B S<PJ H SL<JM M PNJ PXD JHWH W M HDR G>WNW,,B NQRWT H YWRJM W B S<PJ H SL<JM,B NQRH/ H YWR/ W B S<JP/ H SL</,in the caverns of the rocks and in the clefts of the cliffs,0,prep,topo,inanim,det,subs,complex,factive,B,B,,,
212924,SWR[,MT,Isaiah,3,1,MSJR,KJ HNH H >DWN JHWH YB>WT MSJR M JRWCLM W M JHWDH MC<N W MC<NH KL MC<N LXM W KL MC<N MJM,,hif,ptca,KJ HNH H >DWN JHWH YB>WT MSJR M JRWCLM W M JHWDH MC<N W MC<NH KL MC<N LXM W KL MC<N MJM,H >DWN JHWH YB>WT,M JRWCLM W M JHWDH,MN JRWCLM/ W MN JHWDH/,from Jerusalem and from Judah,0,prep,topo,anim inanim,det,nmpr,complex,factive,MN,MN,,,
1895743,SWR[,1Qisaa,Isaiah,3,1,MHSJR,KJ> HNH H >DWN JHWH YB>WT MHSJR M JRWCLM W M JHWDH MC<N W MC<NH KL MC<N LXM W KWL MC<N MJM,000 000 0 0000 0000 00000 00000 0 000000 0 0 00000 0000 0 00000 00 0000 000 0 000 0000 000 00,hif,ptca,KJ> HNH H >DWN JHWH YB>WT MHSJR M JRWCLM W M JHWDH MC<N W MC<NH KL MC<N LXM W KWL MC<N MJM,H >DWN JHWH YB>WT,M JRWCLM W M JHWDH,MN JRWCLM/ W MN JHWDH/,from Jerusalem and from Judah,0,prep,topo,inanim,det,nmpr,complex,factive,MN,MN,,,
1895915,CWB[,1Qisaa,Isaiah,3,11,JCWB,>WJ L RC< R< KJ> GMWL JDW JCWB LW>,000 0 000 00 000 0000 0000 0000 0000 00,qal,impf,KJ> GMWL JDW JCWB LW>,GMWL JDW,LW>,L,to him,0,prep,prps,anim,det,prsf,simple,factive fictive,L,,,,
213114,BW>[,MT,Isaiah,3,14,JBW>,JHWH B MCPV JBW> <M ZQNJ <MW W FRJW W >TM B<RTM H KRM GZLT H <NJ B BTJKM,,qal,impf,JHWH B MCPV JBW> <M ZQNJ <MW W FRJW,JHWH,B MCPV,B MCPV/,in judgment,0,prep,abs,inanim,und,subs,simple,fictive,B,,,,
213114,BW>[,MT,Isaiah,3,14,JBW>,JHWH B MCPV JBW> <M ZQNJ <MW W FRJW W >TM B<RTM H KRM GZLT H <NJ B BTJKM,,qal,impf,JHWH B MCPV JBW> <M ZQNJ <MW W FRJW,JHWH,<M ZQNJ <MW W FRJW,<M ZQN/ <M/ W FR/,with the elder ones of his people and his princes,0,prep,gens,anim,det,subs,complex,factive fictive,<M,,,,
1895945,BW>[,1Qisaa,Isaiah,3,14,JBW>,JHWH B MCPV JBW> <M ZQNJ <MW W FRJW W >TMH B<RTM H KRM GZLT H <NJ B BTJKM,0000 0 0000 0000 00 0000 0000 0 00000 0 0000 00000 0 000 0000 0 000 0 000000 00,qal,impf,JHWH B MCPV JBW> <M ZQNJ <MW W FRJW,JHWH,B MCPV,B MCPV/,in judgment,0,prep,abs,inanim,und,subs,simple,fictive,B,,,,
1895945,BW>[,1Qisaa,Isaiah,3,14,JBW>,JHWH B MCPV JBW> <M ZQNJ <MW W FRJW W >TMH B<RTM H KRM GZLT H <NJ B BTJKM,0000 0 0000 0000 00 0000 0000 0 00000 0 0000 00000 0 000 0000 0 000 0 000000 00,qal,impf,JHWH B MCPV JBW> <M ZQNJ <MW W FRJW,JHWH,<M ZQNJ <MW W FRJW,<M ZQN/ <M/ W FR/,with the elder ones of his people and his princes,0,prep,gens,anim,det,subs,complex,factive fictive,<M,,,,
213573,QRB[,MT,Isaiah,5,8,JQRJBW,HWJ MGJ<J BJT B BJT FDH B FDH JQRJBW <D >PS MQWM W HWCBTM L BDKM B QRB H >RY,,hif,impf,FDH B FDH JQRJBW <D >PS MQWM,,B FDH,B FDH/,in (with) field,0,prep,topo,inanim,und,subs,simple,factive fictive,B,,,,
1896409,QRB[,1Qisaa,Isaiah,5,8,JQRJBW,HWJ MGJ<J BJT BJT FDH B FDH JQRJBW <D >PS MQWM W JCTM L BDKM B QRB H >RY,000 00000 000 000 000 0 000 000000 00 000 0000 0 0000 0 00000 0 000 0 000 00,hif,impf,FDH B FDH JQRJBW <D >PS MQWM,,B FDH,B FDH/,in (with) field,0,prep,topo,inanim,und,subs,simple,factive fictive,B,,,,
214081,<WP[,MT,Isaiah,6,6,J<P,W J<P >LJ >XD MN H FRPJM W B JDW RYPH B MLQXJM LQX M <L H MZBX,,qal,wayq,W J<P >LJ >XD MN H FRPJM,>XD MN H FRPJM,>LJ,>L,to me,0,prep,prps,anim,det,prsf,simple,factive,>L,,,,
1896924,<WP[,1Qisaa,Isaiah,6,6,J<WP,W J<WP >LJ >XD MN H FRPJM W B JDW RYPH B MLQXJM LQX M <L H MZBX,0 0000 0000 000 00 0 00000 0 0 0000 0000 0 000000 000 0 00 0 0000 00,qal,wayy,W J<WP >LJ >XD MN H FRPJM,>XD MN H FRPJM,>LJ,>L,to me,0,prep,prps,anim,det,prsf,simple,factive,>L,,,,
214256,<LH[,MT,Isaiah,7,1,<LH,W JHJ B JMJ >XZ BN JWTM BN <ZJHW MLK JHWDH <LH RYJN MLK >RM W PQX BN RMLJHW MLK JFR>L JRWCLM L MLXMH <LJH W L> JKL L HLXM <LJH,,qal,perf,<LH RYJN MLK >RM W PQX BN RMLJHW MLK JFR>L JRWCLM L MLXMH <LJH,RYJN MLK >RM W PQX BN RMLJHW MLK JFR>L,JRWCLM,JRWCLM/,to Jerusalem,0,vc,topo,inanim,det,nmpr,simple,factive,,,,,
1897102,<LH[,1Qisaa,Isaiah,7,1,<LH,W JHJ B JMJ >XZ BN JWTM BN <WZJH MLK JHWDH <LH RYJN MLK >RM W PQX BN RWMLJH MLK JFR>L JRWCLM L MLXMH <LJH W LW> JKLW L HLXM <LJH,0 000 0 000 000 00 0000 00 00000 000 00000 000 0000 000 000 0 000 00 000000 000 00000 000000 0 00000 00000 0 000 0000 0 0000 00000 00,qal,perf,<LH RYJN MLK >RM W PQX BN RWMLJH MLK JFR>L JRWCLM L MLXMH <LJH,RYJN MLK >RM W PQX BN RWMLJH MLK JFR>L,JRWCLM,JRWCLM/,to Jerusalem,0,vc,topo,inanim,det,nmpr,simple,factive,,,,,
214368,<LH[,MT,Isaiah,7,6,N<LH,N<LH B JHWDH W NQJYNH W NBQ<NH >LJNW W NMLJK MLK B TWKH >T BN VB>L,,qal,impf,N<LH B JHWDH,,B JHWDH,B JHWDH/,against Judah,0,prep,"pers,gens,topo",anim inanim,det,nmpr,simple,factive,B,,,,
1897221,<LH[,1Qisaa,Isaiah,7,6,N<LH,N<LH B JHWDH W NQJYNH W NBQ<NH >LJNW W NMLJK MLK B TWKH >T BN VB>L,0000 0 00000 0 0000000 0 0000000 000000 0 00000 000 0 00000 00 00 0000 00,qal,impf,N<LH B JHWDH,,B JHWDH,B JHWDH/,against  Judah,0,prep,"pers,gens,topo",anim inanim,det,nmpr,simple,factive,B,,,,
214531,BW>[,MT,Isaiah,7,17,JBJ>,JBJ> JHWH <LJK W <L <MK W <L BJT >BJK JMJM >CR L> B>W L M JWM SWR >PRJM M <L JHWDH >T MLK >CWR,,hif,impf,JBJ> JHWH <LJK W <L <MK W <L BJT >BJK JMJM >T MLK >CWR,JHWH,<LJK W <L <MK W <L BJT >BJK,<L W <L <M/ W <L BJT/ >B/,upon you and upon your people and upon the house of your father,0,prep,prps,anim,det,prsf,complex,fictive,<L,<L,<L,,
214548,SWR[,MT,Isaiah,7,17,SWR,JBJ> JHWH <LJK W <L <MK W <L BJT >BJK JMJM >CR L> B>W L M JWM SWR >PRJM M <L JHWDH >T MLK >CWR,,qal,infc,SWR >PRJM M <L JHWDH,>PRJM,M <L JHWDH,MN <L JHWDH/,from Judah,0,prep,"pers,gens,topo",anim inanim,det,nmpr,simple,factive,MN,<L,,,
1897394,BW>[,1Qisaa,Isaiah,7,17,JBJ>,W JBJ> JHWH <LJK W <L <MK W <L BJT >BJK JMJM >CR LW> B>W L M JWM SWR >PRJM M <L JHWDH >T MLK >CWR,0 0000 0000 00000 0 00 0000 0 00 000 00000 0000 000 000 000 0 0 000 000 00000 0 00 00000 00 000 0000 00,hif,impf,W JBJ> JHWH <LJK W <L <MK W <L BJT >BJK JMJM >T MLK >CWR,JHWH,<LJK W <L <MK W <L BJT >BJK,<L W <L <M/ W <L BJT/ >B/,upon you and upon your people and upon the house of your father,0,prep,prps,anim,det,prsf,complex,fictive,<L,<L,<L,,
1897411,SWR[,1Qisaa,Isaiah,7,17,SWR,W JBJ> JHWH <LJK W <L <MK W <L BJT >BJK JMJM >CR LW> B>W L M JWM SWR >PRJM M <L JHWDH >T MLK >CWR,0 0000 0000 00000 0 00 0000 0 00 000 00000 0000 000 000 000 0 0 000 000 00000 0 00 00000 00 000 0000 00,qal,infc,SWR >PRJM M <L JHWDH ,>PRJM,M <L JHWDH,MN <L JHWDH/,from Judah,0,prep,"pers,gens,topo",anim inanim,det,nmpr,simple,factive,MN,<L,,,
214584,NWX[,MT,Isaiah,7,19,NXW,W B>W W NXW KLM B NXLJ H BTWT W B NQJQJ H SL<JM W B KL H N<YWYJM W B KL H NHLLJM,,qal,perf,W NXW KLM B NXLJ H BTWT W B NQJQJ H SL<JM W B KL H N<YWYJM W B KL H NHLLJM,KLM,B NXLJ H BTWT W B NQJQJ H SL<JM W B KL H N<YWYJM W B KL H NHLLJM,B NXL/ H BTH/ W B NQJQ/ H SL</ W B KL/ H N<YWY/ W B KL/ H NHLL/,in the ravines of the precipices and in the clefts of the rocks and in all the thornbushes and in all the watering places,0,prep,topo,inanim,det,subs,complex,factive fictive,B,B,B,B,
1897446,NWX[,1Qisaa,Isaiah,7,19,NXW,W B>W W NXW KWLM B NXLJ H BTWT W B NQJQJ H SL<JM W B KWL H N<YWYJM W B KWL H NHLJLJM,0 000 0 000 00000 0 0000 0 0000 0 0 00000 0 00000 0 0 000 0 0000000 0 0 000 0 0000000 00,qal,perf,W NXW KWLM B NXLJ H BTWT W B NQJQJ H SL<JM W B KWL H N<YWYJM W B KWL H NHLJLJM,KWLM,B NXLJ H BTWT W B NQJQJ H SL<JM W B KWL H N<YWYJM W B KWL H NHLJLJM,B NXL/ H BTH/ W B NQJQ/ H SL</ W B KL/ H N<YWY/ W B KL/ H NHLL/,in the ravines of the precipices and in the clefts of the rocks and in all the thornbushes and in all the watering places,0,prep,topo,inanim,det,subs,complex,factive fictive,B,B,B,B,
214702,BW>[,MT,Isaiah,7,24,JBW>,B XYJM W B QCT JBW> CMH KJ CMJR W CJT THJH KL H >RY,,qal,impf,B XYJM W B QCT JBW> CMH,,CMH,CM,there,1,dir-he,adv,inanim,det,adv,simple,factive,,,,,
1897562,BW>[,1Qisaa,Isaiah,7,24,JBW>,B XYJM W B QCTWT JBW> CMH KJ> CMJR W CJT THJH KWL H >RY,0 0000 0 0 00000 0000 0000 000 0000 0 000 0000 000 0 000 00,qal,impf,B XYJM W B QCTWT JBW> CMH,,CMH,CM,there,1,dir-he,adv,inanim,det,adv,simple,factive,,,,,
1919017,BW>[,1Q8,Isaiah,7,24,JBW>,B XYJM W B QCT JBW> CMH KJ CMJR W CJT THJH KL H >RY,0 0000 0 0 000 0000 0000 00 0000 0 000 0000 00 0 000 00,qal,impf,B XYJM W B QCT JBW> CMH,,CMH,CM,there,1,dir-he,adv,inanim,det,adv,simple,factive,,,,,
214722,BW>[,MT,Isaiah,7,25,TBW>,W KL H HRJM >CR B M<DR J<DRWN L> TBW> CMH JR>T CMJR W CJT W HJH L MCLX CWR W L MRMS FH,,qal,impf,L> TBW> CMH JR>T CMJR W CJT,,CMH,CM,there,1,dir-he,adv,inanim,det,adv,simple,factive,,,,,
1897582,BW>[,1Qisaa,Isaiah,7,25,TBW>,W KWL H HRJM >CR B M<DR J<DRWN LW> TBW> CMH JR>T BRZL CMJR W CJT TJHJH L MCLX CWR W L MRMS FH,0 000 0 0000 000 0 0000 0000000 000 0000 0000 0000 0000 0000 0 000 00000 0 0000 000 0 0 0000 00 00,qal,impf,LW> TBW> CMH JR>T BRZL CMJR W CJT,BRZL written above in the manuscript,CMH,CM,there,1,dir-he,adv,inanim,det,adv,simple,factive,,,,,
1919037,BW>[,1Q8,Isaiah,7,25,TBW,W KL H HRJM >CR B M<DR J<DRWN L> TBW CMH JR>T CMJR W CJT W HJH L MCLX CWR W L MRMS FH,0 00 0 0000 000 0 0000 0000000 00 0001 0000 0000 0000 0 000 0 000 0 0000 000 0 0 0000 00 00,qal,impf,L> TBW CMH JR>T CMJR W CJT,,CMH,CM,there,1,dir-he,adv,inanim,det,adv,simple,factive,,,,,
214768,QRB[,MT,Isaiah,8,3,>QRB,W >QRB >L H NBJ>H W THR W TLD BN W J>MR JHWH >LJ QR> CMW MHR CLL XC BZ,,qal,wayq,W >QRB >L H NBJ>H,,>L H NBJ>H,>L H NBJ>H/,to the prophetess,0,prep,pers,anim,det,subs,simple,factive,>L,,,,
1897634,QRB[,1Qisaa,Isaiah,8,3,>QRB,W >QRB >L H NBJ> W THR W TLD BN W J>WMR JHWH >LJ QR> CMW MHR CLL XC BZ,0 0000 00 0 0000 0 000 0 000 00 0 00000 0000 0000 000 0000 000 000 00 00 00,qal,wayy,W >QRB >L H NBJ>,,>L H NBJ>,>L H NBJ>,to the prophet,0,prep,pers,anim,det,subs,simple,factive,>L,,,,
214840,<LH[,MT,Isaiah,8,7,M<LH,W LKN HNH >DNJ M<LH <LJHM >T MJ H NHR H <YWMJM W H RBJM >T MLK >CWR W >T KL KBWDW W <LH <L KL >PJQJW W HLK <L KL GDWTJW,,hif,ptca,HNH >DNJ M<LH <LJHM >T MJ H NHR H <YWMJM W H RBJM >T MLK >CWR W >T KL KBWDW,>DNJ,<LJHM,<L,against them,0,prep,prps,anim,det,prsf,simple,factive,<L,,,,
214859,<LH[,MT,Isaiah,8,7,<LH,W LKN HNH >DNJ M<LH <LJHM >T MJ H NHR H <YWMJM W H RBJM >T MLK >CWR W >T KL KBWDW W <LH <L KL >PJQJW W HLK <L KL GDWTJW,,qal,perf,W <LH <L KL >PJQJW,,<L KL >PJQJW,<L KL/ >PJQ/,over all its channels,0,prep,topo,inanim,det,subs,complex,factive,<L,,,,
214864,HLK[,MT,Isaiah,8,7,HLK,W LKN HNH >DNJ M<LH <LJHM >T MJ H NHR H <YWMJM W H RBJM >T MLK >CWR W >T KL KBWDW W <LH <L KL >PJQJW W HLK <L KL GDWTJW,,qal,perf,W HLK <L KL GDWTJW,,<L KL GDWTJW,<L KL/ GDJH/,over all its banks,0,prep,topo,inanim,det,subs,complex,factive,<L,,,,
1897717,<LH[,1Qisaa,Isaiah,8,7,M<LH,W L KN HNH >DWNJ JHWH M<LH <LJHM >T MJ H NHR H H <YWMJM W H RBJM >T MLK >CWR W >T KWL KBWDW W <LH <L KWL >PJQJW W HLK <L KWL GDWWTJW,0 0 00 000 00000 0000 0000 000000 00 00 0 000 0 0 000000 0 0 0000 00 000 0000 0 00 000 000000 0 000 00 000 0000000 0 000 00 000 00000000 00,hif,ptca,HNH >DWNJ JHWH M<LH <LJHM >T MJ H NHR H H <YWMJM W H RBJM >T MLK >CWR W >T KWL KBWDW,>DWNJ JHWH,<LJHM,<L,against them,0,prep,prps,anim,det,prsf,simple,factive,<L,,,,
1897737,<LH[,1Qisaa,Isaiah,8,7,<LH,W L KN HNH >DWNJ JHWH M<LH <LJHM >T MJ H NHR H H <YWMJM W H RBJM >T MLK >CWR W >T KWL KBWDW W <LH <L KWL >PJQJW W HLK <L KWL GDWWTJW,0 0 00 000 00000 0000 0000 000000 00 00 0 000 0 0 000000 0 0 0000 00 000 0000 0 00 000 000000 0 000 00 000 0000000 0 000 00 000 00000000 00,qal,perf,W <LH <L KWL >PJQJW,,<L KWL >PJQJW,<L KL/ >PJQ/,over all its channels,0,prep,topo,inanim,det,subs,complex,factive,<L,,,,
1897742,HLK[,1Qisaa,Isaiah,8,7,HLK,W L KN HNH >DWNJ JHWH M<LH <LJHM >T MJ H NHR H H <YWMJM W H RBJM >T MLK >CWR W >T KWL KBWDW W <LH <L KWL >PJQJW W HLK <L KWL GDWWTJW,0 0 00 000 00000 0000 0000 000000 00 00 0 000 0 0 000000 0 0 0000 00 000 0000 0 00 000 000000 0 000 00 000 0000000 0 000 00 000 00000000 00,qal,perf,W HLK <L KWL GDWWTJW,,<L KWL GDWWTJW,<L KL/ GDJH/,over all its banks,0,prep,topo,inanim,det,subs,complex,factive,<L,,,,
214869,XLP[,MT,Isaiah,8,8,XLP,W XLP B JHWDH CVP W <BR <D YW>R JGJ< W HJH MVWT KNPJW ML> RXB >RYK <MNW >L,,qal,perf,W XLP B JHWDH,,B JHWDH,B JHWDH/,in/into Judah,0,prep,"pers,gens,topo",anim inanim,det,nmpr,simple,factive,B,,,,
1897748,XLP[,1Qisaa,Isaiah,8,8,XLP,W XLP B JHWDH CVP W <BR <D YW>R JGJ< W HJH MVWT KNPJW MLW> RXB >RYK <MNW >L,0 000 0 00000 000 0 000 00 0000 0000 0 000 0000 000000 0000 000 00000 0000 00 00,qal,perf,W XLP B JHWDH,,B JHWDH,B JHWDH/,in/into Judah,0,prep,"pers,gens,topo",anim inanim,det,nmpr,simple,factive,B,,,,
214926,HLK[,MT,Isaiah,8,11,LKT,KJ KH >MR JHWH >LJ K XZQT H JD W JSRNJ M LKT B DRK H <M H ZH L >MR,,qal,infc,M LKT B DRK H <M H ZH,,B DRK H <M H ZH,B DRK/ H <M/ H ZH,in the way of this people,0,prep,other,inanim,det,subs,complex,factive fictive,B,,,,
1897804,HLK[,1Qisaa,Isaiah,8,11,LKT,KJ KH >MR JHWH >LJ K XZQT JD JSJRNW M LKT B DRK H <M H ZH L >MWR,00 00 000 0000 0000 0 0000 00 0000000 0 000 0 000 0 00 0 00 0 0000 00,qal,infc,M LKT B DRK H <M H ZH,,B DRK H <M H ZH,B DRK/ H <M/ H ZH,in the way of this people,0,prep,other,inanim,det,subs,complex,factive fictive,B,,,,
215093,<BR[,MT,Isaiah,8,21,<BR,W <BR BH NQCH W R<B W HJH KJ JR<B W HTQYP W QLL B MLKW W B >LHJW W PNH L M<LH,,qal,perf,W <BR BH,,BH,B,in it,0,prep,prps,inanim,det,prsf,simple,factive,B,,,,
215112,PNH[,MT,Isaiah,8,21,PNH,W <BR BH NQCH W R<B W HJH KJ JR<B W HTQYP W QLL B MLKW W B >LHJW W PNH L M<LH,,qal,perf,W PNH L M<LH,,L M<LH,L M<L/,upwards,1,prep + dir-he,dir,inanim,und,subs,simple,factive,L,,,,
1897981,<BR[,1Qisaa,Isaiah,8,21,<BR,W <BR BH W NQCH W R<B W HJH KJ> JR<B JTQYP W QLL B MLKW W B >LWHW W PNH L M<LH,0 000 000 0 0000 0 000 0 000 000 0000 00000 0 000 0 00000 0 0 000000 0 000 0 00000 00,qal,perf,W <BR BH,,BH,B,in it,0,prep,prps,inanim,det,prsf,simple,factive,B,,,,
1898000,PNH[,1Qisaa,Isaiah,8,21,PNH,W <BR BH W NQCH W R<B W HJH KJ> JR<B JTQYP W QLL B MLKW W B >LWHW W PNH L M<LH,0 000 000 0 0000 0 000 0 000 000 0000 00000 0 000 0 00000 0 0 000000 0 000 0 00000 00,qal,perf,W PNH L M<LH,,L M<LH,L M<L/,upwards,1,prep + dir-he,dir,inanim,und,subs,simple,factive,L,,,,
215297,NPL[,MT,Isaiah,9,7,NPL,DBR CLX >DNJ B J<QB W NPL B JFR>L,,qal,perf,W NPL B JFR>L,,B JFR>L,B JFR>L/,on Israel,0,prep,"pers,gens,topo",anim inanim,det,nmpr,simple,fictive,B,,,,
1898195,NPL[,1Qisaa,Isaiah,9,7,NPL,DBR CLX JHWH B J<QWB W NPL B JFR>L,000 000 0000 0 00000 0 000 0 00000 00,qal,perf,W NPL B JFR>L,,B JFR>L,B JFR>L/,on Israel,0,prep,"pers,gens,topo",anim inanim,det,nmpr,simple,fictive,B,,,,
215564,BW>[,MT,Isaiah,10,3,TBW>,W MH T<FW L JWM PQDH W L CW>H M MRXQ TBW> <L MJ TNWSW L <ZRH W >NH T<ZBW KBWDKM,,qal,impf,M MRXQ TBW>,,M MRXQ,MN MRXQ/,from a distant place,0,prep,topo,inanim,und,subs,simple,factive fictive,MN,,,,
215567,NWS[,MT,Isaiah,10,3,TNWSW,W MH T<FW L JWM PQDH W L CW>H M MRXQ TBW> <L MJ TNWSW L <ZRH W >NH T<ZBW KBWDKM,,qal,impf,<L MJ TNWSW L <ZRH,,<L MJ,<L MJ,to whom,0,prep,ppin,anim,und,ppin,simple,factive,<L,,,,
1898482,BW>[,1Qisaa,Isaiah,10,3,TBW>,W MH T<FW L JWM PQWDH W L C>H M MRXQ TBW> <L MJ TNWSW L <ZRH W >NH T<ZWBW KBWDKM,0 00 0000 0 000 00000 0 0 000 0 0000 0000 00 00 00000 0 0000 0 0000 000000 0000000 00,qal,impf,M MRXQ TBW>,,M MRXQ,MN MRXQ/,from a distant place,0,prep,topo,inanim,und,subs,simple,factive fictive,MN,,,,
1898485,NWS[,1Qisaa,Isaiah,10,3,TNWSW,W MH T<FW L JWM PQWDH W L C>H M MRXQ TBW> <L MJ TNWSW L <ZRH W >NH T<ZWBW KBWDKM,0 00 0000 0 000 00000 0 0 000 0 0000 0000 00 00 00000 0 0000 0 0000 000000 0000000 00,qal,impf,<L MJ TNWSW L <ZRH,,<L MJ,<L MJ,to whom,0,prep,ppin,anim,und,ppin,simple,factive,<L,,,,
215581,NPL[,MT,Isaiah,10,4,JPLW,BLTJ KR< TXT >SJR W TXT HRWGJM JPLW B KL Z>T L> CB >PW W <WD JDW NVWJH,,qal,impf,W TXT HRWGJM JPLW,,TXT HRWGJM,TXT/ HRG[,instead of/among the ones being killed,0,prep,pers,anim,und,subs,simple,factive fictive,TXT,,,,
1898500,NPL[,1Qisaa,Isaiah,10,4,JPLW,BLTJ KR< TXT >SWR W TXT HRWGJM JPLW W B KWL ZW>T LW> CB >PW W <WD JDJW NVWJH,0000 000 000 0000 0 000 000000 0000 0 0 000 0000 000 00 0000 0 000 00000 00000 00,qal,impf,W TXT HRWGJM JPLW,,TXT HRWGJM,TXT/ HRG[,instead of/among the ones being killed,0,prep,pers,anim,und,subs,simple,factive fictive,TXT,,,,
215894,CWB[,MT,Isaiah,10,21,JCWB,C>R JCWB C>R J<QB >L >L GBWR,,qal,impf,C>R JCWB C>R J<QB >L >L GBWR,C>R C>R J<QB,>L >L GBWR,>L >L/ GBWR/,to the mighty god,0,prep,pers,anim,und,subs,complex,fictive,>L,,,,
1898827,CWB[,1Qisaa,Isaiah,10,21,JCWB,C>R JCWB C>R J<QWB >L >L GBWR,000 0000 000 00000 00 00 0000 00,qal,impf,C>R JCWB C>R J<QWB >L >L GBWR,C>R JCWB C>R J<QWB,>L >L GBWR,>L >L/ GBWR/,to the mighty god,0,prep,pers,anim,und,subs,complex,fictive,>L,,,,
215910,CWB[,MT,Isaiah,10,22,JCWB,KJ >M JHJH <MK JFR>L K XWL H JM C>R JCWB BW KLJWN XRWY CWVP YDQH,,qal,impf,KJ C>R JCWB BW,C>R,BW,B,to him,0,prep,prps,anim,det,prsf,simple,fictive,B,,,,
1898844,CWB[,1Qisaa,Isaiah,10,22,JCWB,KJ> >M JHJH <MK JFR>L K XWL H JM C>R JCWB BW KLJWN XRWY CWVP YDQH,000 00 0000 0000 00000 0 000 0 00 000 0000 000 00000 0000 0000 0000 00,qal,impf,KJ> >M JHJH <MK JFR>L K XWL H JM C>R JCWB BW,C>R,BW,B,to him,0,prep,prps,anim,det,prsf,simple,fictive,B,,,,
215993,SWR[,MT,Isaiah,10,27,JSWR,W HJH B JWM H HW> JSWR SBLW M <L CKMK W <LW M <L YW>RK W XBL <L M PNJ CMN,,qal,impf,JSWR SBLW M <L CKMK,SBLW,M <L CKMK,MN <L CKM/,from your shoulder,0,prep,bopa,inanim,det,subs,complex,factive fictive,MN,<L,,,
1898931,SWR[,1Qisaa,Isaiah,10,27,JSWR,W HJH B JWM H HW> JSWR SBLW M <L CKMK W <WLW M <L YW>RK W XBL <WL M PNJ CMN,0 000 0 000 0 000 0000 00000 0 00 00000 0 00000 0 00 000000 0 000 000 0 000 000 00,qal,impf,JSWR SBLW M <L CKMK,SBLW,M <L CKMK,MN <L CKM/,from your shoulder,0,prep,bopa,inanim,det,subs,complex,factive fictive,MN,<L,,,
216009,BW>[,MT,Isaiah,10,28,B>,B> <L <JT <BR B MGRWN L MKMF JPQJD KLJW,,qal,perf,B> <L <JT,,<L <JT,<L <JT/,to Aiath,0,prep,topo,inanim,det,nmpr,simple,factive,<L,,,,
216012,<BR[,MT,Isaiah,10,28,<BR,B> <L <JT <BR B MGRWN L MKMF JPQJD KLJW,,qal,perf,<BR B MGRWN,,B MGRWN,B MGRWN/,through Migron,0,prep,topo,inanim,det,nmpr,simple,factive,B,,,,
1898948,BW>[,1Qisaa,Isaiah,10,28,B>,B> <L <JTH <BR B MGRWN L MKMC JPQWD KLJW,00 00 00000 000 0 00000 0 0000 00000 00000 00,qal,perf,B> <L <JTH,,<L <JTH,<L <JT/,to Aiath,1,prep + dir-he,topo,inanim,det,nmpr,simple,factive,<L,,,,
1898951,<BR[,1Qisaa,Isaiah,10,28,<BR,B> <L <JTH <BR B MGRWN L MKMC JPQWD KLJW,00 00 00000 000 0 00000 0 0000 00000 00000 00,qal,perf,<BR B MGRWN,,B MGRWN,B MGRWN/,through Migron,0,prep,topo,inanim,det,nmpr,simple,factive,B,,,,
216019,<BR[,MT,Isaiah,10,29,<BRW,<BRW M<BRH GB< MLWN LNW XRDH H RMH GB<T C>WL NSH,,qal,perf,<BRW M<BRH,,M<BRH,M<BRH/,(in) a pass,0,vc,topo,inanim,und,subs,simple,factive,,,,,
1898959,<BR[,1Qisaa,Isaiah,10,29,<BR,<BR B M<BRH GB< MLWN LNW XRDH H RMH GB<T C>WL NSH,000 0 00000 000 0000 0000 0000 0 000 0000 0000 000 00,qal,perf,<BR B M<BRH,,B M<BRH,B M<BRH/,(in) a pass,0,prep,topo,inanim,und,subs,simple,factive,B,,,,
216091,JY>[,MT,Isaiah,11,1,JY>,W JY> XVR M GZ< JCJ W NYR M CRCJW JPRH,,qal,perf,W JY> XVR M GZ< JCJ,XVR,M GZ< JCJ,MN GZ</ JCJ/,from the stump of Jesse,0,prep,obj,inanim,det,subs,complex,factive fictive,MN,,,,
1899037,JY>[,1Qisaa,Isaiah,11,1,JY>,W JY> XVR M GZ< JCJ W NYR M CWRCJW JPRH,0 000 000 0 000 000 0 000 0 0000000 0000 00,qal,perf,W JY> XVR M GZ< JCJ,XVR,M GZ< JCJ,MN GZ</ JCJ/,from the stump of Jesse,0,prep,obj,inanim,det,subs,complex,factive fictive,MN,,,,
